1, ( ) with five years ago, there are a larger number of people using social media., Compared, Comparing, By comparing, Having compared, 日本大学, 2, 「～と比較すると」という慣用的な分詞構文です。主節の内容（SNS利用者の増加）と「5年前」が比較される受動の関係になるため、過去分詞の Compared を用います。
2, Mt. Fuji is the highest mountain in Japan, its highest peak ( ) 3,776 meters above sea level., being, is, to be, has been, 日本大学, 3, カンマで区切られた独立分詞構文の問題です。主節（Mt. Fuji is...）とは別に「その最高峰が～である状態で」という付帯状況を説明しており、接続詞がないため動詞の is ではなく分詞の being を用います。
3, ( ) as the leading actor in the film, Ramesh soon became a star., Having been chosen, Choosing, Having chosen, To choose, センター試験, 2, 完了形の受動態を用いた分詞構文です。「主役として選ばれた」という、主節の動作（became a star）よりも前の出来事であり、かつ「選ばれる」という受動の関係であるため、Having been chosen が適切です。
4, Scott went to the police station because he ( )., had his computer stolen, caused his computer stolen, got stolen his computer, was stolen his computer, センター試験, 2, have + 物 + 過去分詞 で「（被害を受けて）物を〜される」という形を作る問題です。日本語の「盗まれた」に引っ張られて was stolen を選ばないよう注意が必要です。
5, When I looked out of the window last night, I saw a cat ( ) into my neighbor's yard., sneaking, is sneaked, sneaks, to sneak, センター試験, 2, 知覚動詞 see + 目的語 + 現在分詞（〜しているのを見かける）の語法です。猫が「忍び込んでいる」という能動の関係なので sneaking が適切です。
8, ( ) from studying all night last night, he fell asleep during his afternoon class., Exhausting, Having exhausted, Exhausted, After exhausting, 中央大学, 2, 過去分詞を用いた分詞構文です。主語の he が「疲れ果てさせられた（＝疲れた）」という受動の関係になるため、過去分詞 Exhausted を用います。
